data-division,data-items-familyName,data-items-species-speciesName,data-items-species-above.,data-items-species-folders-description,data-items-species-folders-prepared.,data-items-species-folders-above.
DICOTYLEDONES,CALYCIPLORAE,w. Leaves and young flower shoots.,,w. Leaves and young flower shoots.,,
DICOTYLEDONES,CALYCIPLORAE,x. Sketches of leaflets.,,x. Sketches of leaflets.,,
DICOTYLEDONES,CALYCIPLORAE,"y. Tracing of leaves and flowers, and dissections of flowers and fruits.",,"y. Tracing of leaves and flowers, and dissections of flowers and fruits.",,
DICOTYLEDONES,CALYCIPLORAE,Observation,,"Ce n'est pas sans quelque hesitation que je rapporte cette espee au Myropernum toluiferum. Cette espee est en effet, fort peu connue, et je ne connais pas encore une description de ses fleurs et de ses fruits.",,
DICOTYLEDONES,CALYCIPLORAE,Detached leaflets and fruit,,"Detached leaflets and fruit. (Dr. Morales, Cuba, to C. Wright ; C. Wright to Asa Gray ; Asa Gray to me.)",,
DICOTYLEDONES,CALYCIPLORAE,"Flowering twigs, with detached fruits and leaflets",,"Flowering twigs, with detached fruits and leaflets (two specimens).",,
DICOTYLEDONES,CALYCIPLORAE,Leafy shoots,,"Leafy shoots. Cultivated at Clapham, 1864.",,
DICOTYLEDONES,CALYCIPLORAE,Leafy shoot and pods,,Leafy shoot and pods.,,
DICOTYLEDONES,CALYCIPLORAE,"Twigs, with flowers",,"Twigs, with flowers, 1867.",,
DICOTYLEDONES,CALYCIPLORAE,Detached leaves and mature pod,,Detached leaves and mature pod.,,
DICOTYLEDONES,CALYCIPLORAE,"Detached leaves, bark, and fruits",,"Detached leaves, bark, and fruits.",,
DICOTYLEDONES,CALYCIPLORAE,Frijolillo,,"Frijolillo. (P. grandiflora, Benth.) between Gorgona and Matachin Panama. S. Hayes; 12 Mar., 1861.",,
DICOTYLEDONES,CALYCIPLORAE,"Pterocarpus Draco, L.",,"Leaves and detached inflorescence, and flowers.",,
DICOTYLEDONES,CALYCIPLORAE,"Pterocarpus rufescens, Benth.",,"Leaf, inflorescence, fruit, and detached flowers.",,
DICOTYLEDONES,CALYCIPLORAE,"Etamia monosperma, Boiss.",,"Leafless twig, with detached pod.",,
DICOTYLEDONES,CALYCIPLORAE,"[Cytisus purgans, Benth.]; Sarothamnus purgans, Godr. and Greu.",,With flowers.,,
DICOTYLEDONES,CALYCIPLORAE,"[Cytisus scoparius, Link.]; Spartium scoparium, L.",,"Flowering twig, with detached fruits and flowers.",,
DICOTYLEDONES,CALYCIPLORAE,"Sesbania (Egyptiaca, Pers.?) ""Jhanjan"" (Hind.)",,"Twig, with leaves and pods.",,
DICOTYLEDONES,CALYCIPLORAE,"Sophora Grifithii, Stocks. ""Zergul""",,Leafy twig.,,
DICOTYLEDONES,CALYCIPLORAE,"Sophora Japonica, Linn.",,Flowering branchlet.,,
DICOTYLEDONES,CALYCIPLORAE,"Spartium juncceum, L.",,Flowering shoot.,,
DICOTYLEDONES,CALYCIPLORAE,"Tephrosia apollines, D. C.",,"Twig, with flowers and young fruit.",,
DICOTYLEDONES,CALYCIPLORAE,Trifolium repens? L.,,Flowering stems.,,
DICOTYLEDONES,CALYCIPLORAE,"Trigonella Fenum-graecum, L.",,"Branch, with flowers and fruit.",,
DICOTYLEDONES,CALYCIPLORAE,Bauhinia species,,Leafy twig. No locality given.,,
DICOTYLEDONES,CALYCIPLORAE,"Cesalpinia Boudou, L.",,"Twig with flower buds. Stewart, 'Punjab Plants,' p. 69.",,
DICOTYLEDONES,CALYCIPLORAE,"Campsiandra haurifolia, Bentb.",,"Leafy twigs with flowers, and (b) detached flower. H. W. Bates, Para.",,
DICOTYLEDONES,CALYCIPLORAE,"Cassia Brasiliana, Lam.",,"Twig with detached flowers. 'Plants of the Isthmus of Panama,' No. 754 ; S. Hayes.",,
DICOTYLEDONES,CALYCIPLORAE,"Cassia Fistula, L.",,"Twig in flower. Lower Egypt; 1860 ; S. Stafford Allen, (with legumes). The following note from the above-named gentleman is attached to this sheet. ""Specimens of the ripe pod, with some dried leaves and flowers, gathered near Cairo, 28 June, 1864. The tree is not uncommon in the gardens round Cairo; it is known to the Arabs under the name of Heyar Shembi, and is said to be used as a purgative. The flowers, which were rather past their prime at the above date, hung all over the the tree in long drooping spikes, and had an agreeable smell. The ripe dried pods hung singly and in small bunches at the same time; but if required for use would doubtless have been gathered before many of them had been eaten into by insects.""—S. S. Allen.",,
DICOTYLEDONES,CALYCIPLORAE,"Cassia Marilandica, L.",,"With flowers and fruit on separate twigs. Banks of streams, Cooper's Point ; flowers, 2 Oct., 1860 ; fruit, 9 Jan.",,
DICOTYLEDONES,CALYCIPLORAE,"Cassia moschata, H.B.K.",,"Leafy twig and detached flowers. Plants of the Isthmus of Panama, No. 58 ; S. Hayes. In woods, Paraiso Station, Panama ; March, 1863. A tree 30-40 feet high. Petals yellow, at length turning to a brick yellow. ""Canafistola de Purgar."" [Sheet e has a figure of the plant and fruit taken from Linn. Soc. Trans., vol. xxiv., pl. 26.]",,
DICOTYLEDONES,CALYCIPLORAE,"Cassia moschata, H.B.K.",,"Young leaves, detached flowers and portion of fruit; and twig of a young plant cultivated at Clapham, 1865. A pen and ink sketch of the corolla and stamens and dissected flower are attached to this sheet. ""On slopes of hills near Rio Grande Sta. P.R.R. ; 20 Feb., 1861. A spreading tree 20-40 feet high. Flowers yellowish-brown. The fruit of this tree is called by the natives ""Canafistola de purgar "" and used as a laxative. It is often nearly 2 feet in length."" S. Hayes.",,
DICOTYLEDONES,CALYCIPLORAE,"Cassia obtusata, Hayne, (Arney-Gewachse ix. 43).",,With flowers and pods. Egypt ; 1863 ; T. W. Beddome.,,
DICOTYLEDONES,CALYCIPLORAE,"Cassia occidentalis, L.",,"Leafy shoot with flowers. [Hanbury adopted temporarily the name given in Stewart, in 'Punjab Plants,' but the specimen is undoubtedly C. occidentalis L.]",,
DICOTYLEDONES,CALYCIPLORAE,"Cassia reticulata, Wild. ""Guayava""",,"a. Leaf and detached flowers. Sonsonate, State of Salvador ; Dr. C. Dorat ; Oct., 1860.",,
DICOTYLEDONES,CALYCIPLORAE,"Ceratonia Siliqua, L.",,"a. Flowering branchlet. Caffa, Syria ; 15 Oct., 1860 ; Dr. J. D. Hooker and D. Hanbury.",,
DICOTYLEDONES,CALYCIPLORAE,"Ceratonia Siliqua, L.",,"b. Ditto, with young pods and detached ripe fruit. Beyrount, Syria, Dr. J. D. Hooper and D. Hanbury.",,
DICOTYLEDONES,CALYCIPLORAE,"Copaifera Langsdorffii, Desf.",,"a. Twigs in flower, and detached leaves, flowers, and fruits. Campinas, Brazil, J. C. de Mello ; received 1865. ""Agrees best with C. Langsdorffii. Leaves pellucid- punctate!"" -D.H.",,
DICOTYLEDONES,CALYCIPLORAE,"Copaifera officinalis, Jacq. (C. Jacquinii, Desf.)",,"a. Branchlet, with flowerbuds. b. Ditto, with flowers. Trinidad, Dr. Cruger, 1862.",,
DICOTYLEDONES,CALYCIPLORAE,"Copaifera officinalis, Jacq. (C. Jacquinii, Desf.)",,"c. d. With young fruits and detached ripe fruits. ""Along the line of the Panama railroad, about three miles from Panama ; Sept., 1861. A fine tree 40-60 ft. high. Fruit ripe in February ;"" S. Hayes, No. 410.",,
DICOTYLEDONES,CALYCIPLORAE,e. Leafy twig. Cultivated in the hothouse at Clapham Common; 21 Feb. 1868.,,e. Leafy twig. Cultivated in the hothouse at Clapham Common; 21 Feb. 1868.,,
DICOTYLEDONES,CALYCIPLORAE,"f. Leafy twig. ""Copifera, sp. nov."" The Grubban Chiriqui (with bottle No. 2); A. J. de Warszewicz; May, 1851. ""The fruit not found to agree with any specimen in the British Museum. Compared with the plates and descriptions in Hayne's Getreue Darstellung und Beschreibung der in der Arzneikunde gebrauchlichen Gewächse, Berlin, 1827, it appeared most to resemble Copifera Janseni. - D. H. 211. Copaifera pubiflora, Benth? a. Branchlet in flower. Cantagallo, Brazil; Theodor Pockolt; 1864. ""Very near to C. pubiflora, Benth., with which, as well as with other specimens of Copifera, Mr. Bentham and I compared it 18 Mar., 1864. Differs from M. Bentham's species C. pubiflora in having the leaflets more acuminate."" - D. H. 212 [Dimorphandra oleifera, Triana;] Mora sp. a. Flowering twig, with leaves. Plants of Central America, Sutton Hayes, No. 69. ""The fruit of this tree is a great pod from 6 to 10 inches long and 4 to 5 inches thick; with two fully ripened seeds. Often I am told by the natives from Cartagena that it is the same tree as that from which the ""Aceite de Canini"" (which I think must be Gum Animi) is obtained along the coast. I have cut into the trees in the swamp, near Panama, and I find a beautiful balsam exudes. The wood, as far as I have examined, is close grained, and of a very light yellowish colour, and very different from that of the Mora excelens."" - S. Hayes. ""In the tidal swamps bordering the Rio Grande, near Panama; 1 June, 1861. A spreading tree, 30 to 40 feet high. I have only seen this tree growing in swampy ground, almost isolated in great patches of Acrostichum aureum."" - S. Hayes. [This specimen corresponds well with Dimorphandra oleifera, Triana, in the Kew Herbarium.] 213. Parkinsonia aculeata, D.C. a. Flowering twig, with leaves and young pods. Stewart, 'Punjab Plants,' p. 73. Native name, ""Nilayaty babul,"" i.e., foreign acacia. 214. Prioria copaifera, Griseb. a. Flowering twig, with leaves and detached fruit. Plants of Central America, Sutton Hayes, No. 49. Very common in swamps along the line of the P. R. R.; Feb., 1861. One of the largest trees on the Isthmus, 100 feet high or more.",,"f. Leafy twig. ""Copifera, sp. nov."" The Grubban Chiriqui (with bottle No. 2); A. J. de Warszewicz; May, 1851. ""The fruit not found to agree with any specimen in the British Museum. Compared with the plates and descriptions in Hayne's Getreue Darstellung und Beschreibung der in der Arzneikunde gebrauchlichen Gewächse, Berlin, 1827, it appeared most to resemble Copifera Janseni. - D. H. 211. Copaifera pubiflora, Benth? a. Branchlet in flower. Cantagallo, Brazil; Theodor Pockolt; 1864. ""Very near to C. pubiflora, Benth., with which, as well as with other specimens of Copifera, Mr. Bentham and I compared it 18 Mar., 1864. Differs from M. Bentham's species C. pubiflora in having the leaflets more acuminate."" - D. H. 212 [Dimorphandra oleifera, Triana;] Mora sp. a. Flowering twig, with leaves. Plants of Central America, Sutton Hayes, No. 69. ""The fruit of this tree is a great pod from 6 to 10 inches long and 4 to 5 inches thick; with two fully ripened seeds. Often I am told by the natives from Cartagena that it is the same tree as that from which the ""Aceite de Canini"" (which I think must be Gum Animi) is obtained along the coast. I have cut into the trees in the swamp, near Panama, and I find a beautiful balsam exudes. The wood, as far as I have examined, is close grained, and of a very light yellowish colour, and very different from that of the Mora excelens."" - S. Hayes. ""In the tidal swamps bordering the Rio Grande, near Panama; 1 June, 1861. A spreading tree, 30 to 40 feet high. I have only seen this tree growing in swampy ground, almost isolated in great patches of Acrostichum aureum."" - S. Hayes. [This specimen corresponds well with Dimorphandra oleifera, Triana, in the Kew Herbarium.] 213. Parkinsonia aculeata, D.C. a. Flowering twig, with leaves and young pods. Stewart, 'Punjab Plants,' p. 73. Native name, ""Nilayaty babul,"" i.e., foreign acacia. 214. Prioria copaifera, Griseb. a. Flowering twig, with leaves and detached fruit. Plants of Central America, Sutton Hayes, No. 49. Very common in swamps along the line of the P. R. R.; Feb., 1861. One of the largest trees on the Isthmus, 100 feet high or more.",,
DICOTYLEDONES,CALYCIPLORAE,SUBORDER III. MIMOSAE.,,SUBORDER III. MIMOSAE.,,
DICOTYLEDONES,CALYCIPLORAE,"215. Acacia arabica, Willd. ""Kikar"" (Pl). a. Flowering twig. Stewart, 'Punjab Plants,' p. 50.",,"215. Acacia arabica, Willd. ""Kikar"" (Pl). a. Flowering twig. Stewart, 'Punjab Plants,' p. 50.",,
DICOTYLEDONES,CALYCIPLORAE,"216. Acacia Catechu, Willd. a. Twig, and detached spike of flowers. With a specimen of the wood, and the extract made therefrom. From F. E. G. Mathews, Naini Tal, N.W. India, July, 1871. [See Hanbury Collection of Materia Medica.]",,"216. Acacia Catechu, Willd. a. Twig, and detached spike of flowers. With a specimen of the wood, and the extract made therefrom. From F. E. G. Mathews, Naini Tal, N.W. India, July, 1871. [See Hanbury Collection of Materia Medica.]",,
DICOTYLEDONES,CALYCIPLORAE,"217. Acacia Farnesiana, Willd. (Mimosa Farnesiana, L., Vachellia Farnesiana, W. & A.) a. Flowering twigs. Cultivated at Cannes, Provence, 1858. b. (1) Leafy twig. Cultivated at Larnaka, Cyprus, 24 Sept., 1860. Dr. D. J. Hooker and D. Hanbury. (2) Flowering twig and pod detached. Cultivated at Jerusalem, Oct., 1860. ""Noticed it also near Beyrouth, apparently wild.""-D.H.",,"217. Acacia Farnesiana, Willd. (Mimosa Farnesiana, L., Vachellia Farnesiana, W. & A.) a. Flowering twigs. Cultivated at Cannes, Provence, 1858. b. (1) Leafy twig. Cultivated at Larnaka, Cyprus, 24 Sept., 1860. Dr. D. J. Hooker and D. Hanbury. (2) Flowering twig and pod detached. Cultivated at Jerusalem, Oct., 1860. ""Noticed it also near Beyrouth, apparently wild.""-D.H.",,
DICOTYLEDONES,CALYCIPLORAE,"Acacia Seyal, Delil.",,"Leafy twigs. Engedi ; Plants of Southern Syria, 1863-4 ; B. T. Lowne.",,
DICOTYLEDONES,CALYCIPLORAE,"Enterolobium ellipticum, Benth.",,"Leafy twig, detached flower, and pencil sketch of pod. No. 4, with pods (side Hanbury Materia Medica Collection), Joaquim Correa de Mello, Campinas, San Paulo, Brazil, 1865. The flowers are from the same specimen. ""The legume has a velvety surface.""- D.H.",,
DICOTYLEDONES,CALYCIPLORAE,"Enterolobium Timbo-uru, Mart.",,"Leaves, with pod and seed detached. ""Raised from seed in hothouse at Clapham. Tree about 8 feet high where these leaves were gathered, 1866."" D.H.",,
DICOTYLEDONES,CALYCIPLORAE,"Inga globulifera, Benth.",,"Flowering twigs. No. 641, Pithecolobium sp. ""In open woods, Paraiso Station, Panama."" A tree 15 to 20 feet high; flowers very fragrant."" -S. Hayes. [In Kew Herbarium this plant is labelled No. 680. ""Plants of the Isthmus of Panama."" -S. Hayes.] [The dried flowers have an odour resembling fenugreek.]",,
DICOTYLEDONES,CALYCIPLORAE,"Inga Lindeniiana, Benth.",,"Mimosee, p. 622, No. 101]; Inga Mucuna, Walp. and Duchas. a. Flowering twig, and leaves and detached flowers. Dr. Dorat, Sonsonate; 7 Sept., 1863. [The following note, extracted from a letter from Dr. Dorat, is written on this sheet]:- ""I also send a flower of the ""Gujiiniquil,"" a large tree producing a very large and long pod resembling a bean pod, with large seeds, much relished here. The tree produces in the dry season a very odoriferous resin or gum of healing properties, and somewhat resembling India-rubber, as it hardens by washing with alum."" (One ought to see the legume.-D. H.)",,
DICOTYLEDONES,CALYCIPLORAE,"Lagonychium Stephanianum, Rich.",,"Flowering and fruiting twigs. (1) Leafy twig, with attached pods Califa; 1 Nov., 1860; a weed in the fields. (2) Leafy twig, with ripe pods. Between Riha (ancient Jericho) and the Jordan; bushes 4-5 ft. high; 21 Oct., 1860. Dr. D. J. Hooker and D. Hanbury. (3) Twig, with flower- buds; Akka, Syria; E. Atkinson. (4) Twigs and young pods; Larnaka, Cyprus; 24 Sept., 1860. - D.H. A weed in the fields by the roadside.",,
DICOTYLEDONES,CALYCIPLORAE,"Prosopis spicigera, L.",,"""Jand or jhand"" (Pt., Hi.) a. Leafy twig. Stewart, Punjab Plants, p. 74.",,
DICOTYLEDONES,N/A,C,,HRYSOBALANEE.,,
DICOTYLEDONES,N/A,"Chrysobalanus Icaco, Adans.",,"Flowering twig. Dr. Dorat, Sonsonate, 1863.",,
DICOTYLEDONES,N/A,Potentilla,,Tribe VI. P,,
DICOTYLEDONES,P,"Geum urbanum, L.",,"Plant, with flowers and rhizome. Gravesend, July 1856.",,
DICOTYLEDONES,P,"Potentilla Tormentilla, Nestler.",,"Plant, with flowers and rhizome. Wandsworth Common, 1854.",,
DICOTYLEDONES,N/A,Poterium,,,,
DICOTYLEDONES,N/A,"Agrimonia Eupatoria, L.",,"Plant in flower. Merstham, Surrey ; 27 July, 1858.",,
DICOTYLEDONES,N/A,"Brayaera anthelmintica, Kth. : (Hagenia Abyssinica, Lam.)",,Separate twigs bearing (1) male and (2) female infores- cence. From the imported drug.,,
DICOTYLEDONES,N/A,"Brayaera anthelmintica, Kth. : (Hagenia Abyssinica, Lam.)",,"Male inforescence. From Dr. Th. W. C. Martius, Erlangen ; 1862.",,
DICOTYLEDONES,N/A,R,,OSEE.,,
DICOTYLEDONES,Rosa,"Rosa bifera, Poiret, Encyclopédie Redonté, p. 107.",,"Called ""Rose de Puteaux,"" because cultivated especially about Puteaux, near Paris, for medicinal use. From the Jardin Botanique de l'Ecole de Medicine, Paris ; 21 June, 1872. "" A specimen is in Herb. Gay. at Kew.""—D.H.",,
DICOTYLEDONES,Rosa,"Rosa centifolia, L.",,"Flowering twig (flore subinflor). Hort. Bot. Giessen; from Professor Phebus, Giessen; 1864.",,
DICOTYLEDONES,Rosa,"Rosa centifolia, L.",,"Flowering twig. Cultivated at Mitcham; 7 July, 1859. ""Pereira considered it to be var. a; vulgiris, f. foliacea of D.C.""-D.H.",,
DICOTYLEDONES,Rosa,"Rosa Damascena, var. a.",,"With flowers and buds. This is the rose cultivated in Turkey for the production of Otto of Rose. Sent by Professor Dr. Baur, of Constantinople to his father, Dr. Blanheuren, of Wurttemburg, who has the plant in cultivation. Hugo von Mohl examined this rose; see Wiggers in Husemann, Jahresbericht, 1867, p. 350. J. G. Baker says: ""This rose is certainly R. turbinata Ait., R. campanulata Ehrh., R. francofurtensis Hort.; Nov. 1874.""-D.H. A letter from Dr. Baur is attached to this specimen.",,
DICOTYLEDONES,Rosa,"Rosa Damascena, var. a.",,"Flowering twig. Flower produced at Clapham in summer of 1874. From a plant given me by Dr. Baur, of Blauheuren.",,
DICOTYLEDONES,Rosa,"Rosa Damascena, var. a.",,"Flowering twig. Golfe de Juan, near Cannes; May, 1866; cultivated for its flowers, which are distilled to make rose water. -D.H.",,
DICOTYLEDONES,Rosa,"Rosa Gallica, L.",,"Flowering twigs. Cultivated, Mitcham; 7 July, 1859. According to Pereira It is var. 8 officinalis D.C.",,
DICOTYLEDONES,Rosa,"Rosa Gallica, L.",,"Ditto, flowers semi-double, with detached fruit. From the garden at Clapham Common; 1873. Var. Damascena, Miller. (So called by J. G. Baker), Nov., 1876.",,
DICOTYLEDONES,Rosa,"Rosa Gallica, L.",,"Twigs with flo er-buds. ""Rose cultivated for the production of attar; from Vice- Consaul Dupuis, Adrianople; 1874."" The specimens on the upper portion of this sheet are marked: ""Rose cultivated at Kazanlik, near Adrianople, for distilling attar or rose oil; received in a packet some days later than the others.",,
DICOTYLEDONES,HAMAMELIDEAE,"Liquidambar Altingiana, Blume",,"Twigs, with flowers. Assam collection ; Herb Griffith, No. 920.",,
DICOTYLEDONES,HAMAMELIDEAE,"Liquidambar Altingiana, Blume",,"Twig, with fruit. Assam collection ; Herb Griffith, No. 920.",,
DICOTYLEDONES,HAMAMELIDEAE,"Liquidambar Formosana, Hance",,"Leaves and fruit. Leaves from Herb. H. F. Hance, Whampaes ; May, 1857. Fruit, Formosa (per B. Swinhoe to Kew).",,
DICOTYLEDONES,HAMAMELIDEAE,"Liquidambar Formosana, Hance",,"Leafy twig. Herb. H. F. Hance, No. 11209. ""Prope monasterium versus cacumina montes Pakwan, supra urbem Cantonem; Julio, 1867. Arbor 50 podalis et ultra.""",,
DICOTYLEDONES,HAMAMELIDEAE,"Liquidambar orientale, Mill.",,"Leafy twigs, and fruiting twig without leaves, two sheets. Coast of Asia Minor, opposite the Island of Rhodes. From S. H. Maltass, 1855. "" Liquid storax is obtained from this tree. See my paper on storax in the Pharmaceutical Journal and Tran- sactions for Feb. and Mar., 1857 (3), xvi., p. 461."" -D. H.",,
DICOTYLEDONES,HAMAMELIDEAE,"Liquidambar orientale, Mill.",,"Leafy twig, with detached fruit. Coast of Asia Minor, opposite the Island of Rhodes, S. H. Maltass, 1855. An engraving of the fruit (taken from Pharm. Journ. (1), xvi., p. 462) accompanies this specimen.",,
DICOTYLEDONES,HAMAMELIDEAE,"Liquidambar orientale, Mill.",,"Leafy twig, with fruit. Bot. Garden, Marseilles ; 14 Nov., 1860. Dr. J. D. Hooker and D. Hanbury.",,
DICOTYLEDONES,HAMAMELIDEAE,"Liquidambar orientale, Mill.",,"Three twigs, in flower, with detached leaves. Bot. Garden, St. Mandriér, near Toulon ; M. Phillippe. A letter from M. Phillippe, dated 4 June, 1860, accom- panies this specimen, stating that he has forwarded the specimens desired.",,
DICOTYLEDONES,HAMAMELIDEAE,"Liquidambar orientale, Mill.",,"Leafy twig. Bot. Garden, Venice ; 13 Sept., 1860 ; Dr. J. D. Hooker and D. Hanbury.",,
DICOTYLEDONES,HAMAMELIDEAE,"Liquidambar styraciflua, L.",,"Twig, with fruit. Guatemala, 1862. From G. U. Skinner to Dr. Pereira with some of the balsamic semi-fluid resin of the tree. - D. H.",,
DICOTYLEDONES,HAMAMELIDEAE,"Liquidambar styraciflua, L.",,"Twig, with detached fruit. Bot. Gardens, Turin ; 11 Sept., 1860. - D. H.",,
DICOTYLEDONES,HAMAMELIDEAE,"Liquidambar styraciflua, L.",,"Leafy twig. From Mr. Bockett's garden, Clapham Common ; 8 Aug., 1874.",,
DICOTYLEDONES,COMBRETACE.E.,"Gyrocarpus asiaticus, Willd. ""Palo Lagarto""",,"Fruiting twig, without leaves.",,
DICOTYLEDONES,MYRTACE.E.,"Couratari legalis, Mart.",,"Flowering twig, with unexpanded flowers. No. 297, Cantagallo, Brazil ; Theodor Peckolt, 1864. On the sheet is a pen and ink sketch of the flower, and a pencil drawing of the young fruit and united stamens, separately delineated. [This plant affords the Joquitha bark used as a tonic in baths for convalescents.]",,
DICOTYLEDONES,MYRTACE.E.,"Marlieria glomerata, Benth. (Rubachia glomerata, Berg.)",,"Flowering twig. No. 34, Cimbuca do Mato. Theodor Peckolt, Cantagallo, Brazil, 1867; Fruit edible.",,
DICOTYLEDONES,MYRTACE.E.,"Papaya sp. ""Chamburu de Quito""",,"Stem leaf. b. Stem leaf. c. Small leaves from the stem. The leaves from a plant cultivated at Palazzo Orego; 17 May, 1869. This plant blossomed in the open border at Clapham Common, Sept., 1874; producing male flowers, with a few solitary females. [See notes on Papayaceae, by De Mello and Spruce; Jour. Linn. Soc., Bot. vol. x. (1869), p. 11.] To specimen s is attached a drawing of the flowers, and to c, one of the tree as grown at Palazzo Orego, showing the small intermediate leaves. An engraving of Carica auranitica also accompanies these specimens.",,
DICOTYLEDONES,MYRTACE.E.,Orygia trianthemoides,,With flower and fruit.,,
DICOTYLEDONES,MYRTACE.E.,"Trianthema sp. (T. obcordata, Roxb.?) ""Wasa""",,"Leafy branchlet. Apparently from India, but no locality given.",,
DICOTYLEDONES,MYRTACE.E.,"Hydrocotyle asiatica, L.",,"Plant in fruit ; received 22 Feb., 1858. India. A beautiful coloured drawing of the plant accom- panies this specimen, on which is written in Dr. Clegghorn's handwriting: ""Madras, in a Betel Garden, H. Clegghorn, Jan., 1858."" [The specimen and drawing were sent by Dr. Clegghorn.]",,
DICOTYLEDONES,MYRTACE.E.,"Hydrocotyle vulgaris, L.",,"Plant in flowers and fruit. Clapham Common, 27 Sept., 1857.",,
DICOTYLEDONES,MYRTACE.E.,"Sanicula europea, L.",,"Plant, with flowers and young fruit. Lindfield, Sussex, 21 July, 1853.",,
DICOTYLEDONES,MYRTACE.E.,"Egopodium Podagraria, L.",,"Plant in flower. Dorking, 25 June, 1858.",,
DICOTYLEDONES,MYRTACE.E.,"Athusa Cynapium, L.",,"Flowering, and fruiting branch and root. Clapham, 13 Aug., 1854.",,
DICOTYLEDONES,MYRTACE.E.,"Athusa Cynapium, L.",,"Large radical leaves, and a flowering branch. In the garden at Clapham Common ; a common weed in the horseradish bed ; July, 1874.",,
DICOTYLEDONES,MYRTACE.E.,"Ammi Visnaga, Lam.",,"Flowering twig, and detached. Fruiting umbel. Smyrna ; 21 Sept., 1860.",,
DICOTYLEDONES,MYRTACE.E.,"Ammi Visnaga, Lam.",,"Fruiting umbel. Smyrna ; 21 Sept., 1860 ; Dr. J. D. Hooker and D. Hanbury.",,
DICOTYLEDONES,MYRTACE.E.,"Carum Carui, L.",,"Young plant, with root, showing radical leaves and root. Cultivated at Clapham, July, 1873.",,
DICOTYLEDONES,MYRTACE.E.,"Carum Carui, L.",,"Ditto. Ditto, with unexpanded flowers.",,
DICOTYLEDONES,MYRTACE.E.,"Carum Carui, L.",,"Ditto, with immature fruit and flower.",,
DICOTYLEDONES,MYRTACE.E.,"Carum Carui, L.",,"Ditto, with green fully developed fruit.",,
DICOTYLEDONES,MYRTACE.E.,"Carum Carui, L.",,"Ditto, with ripe fruit.",,
DICOTYLEDONES,MYRTACE.E.,"Carum Carui, L.",,"Ditto, with immature fruit. Specimen (g) was raised from Morocco seed by F. J. Hanbury, 1872.",,
DICOTYLEDONES,MYRTACE.E.,"Conium maculatum, L.",,"Branch with flowers and young fruit. Erith, Kent, July, 1859.",,
DICOTYLEDONES,MYRTACE.E.,"Ferula alliace, Boiss.",,"Leaves and umbels of young fruit and detached flowering umbels. Plant which produces the variety of Assafetida known at Bombay as Hing. Grows, according to Dr. Dynock, in Yezd and Kerman, from one of which places this specimen was sent.",,
DICOTYLEDONES,MYRTACE.E.,"Ferula alliace, Boiss.",,"Blossom, fertile and unfertile, from the same plant.",,
DICOTYLEDONES,MYRTACE.E.,"Ferula alliace, Boiss.",,"Abortive flowers (with) stylopodium, very irregularly lobed or notched round the margin. The umbels are glabrous, no male flowers could be found ; young fruit quite glabrous, grooved, not (as in Scorodosma) plump and hairy; 11 Nov., 1874.",,
DICOTYLEDONES,MYRTACE.E.,"Ferula alliace, Boiss.",,"A sketch in pencil of abortive flowers and young fruit is attached to this sheet. [The umbels in the dried specimens have stunted peduncles— barely an inch long, although the pedicels are 14 to 15 inches long.]",,
DICOTYLEDONES,MYRTACE.E.,"Ferula Narthex, Boiss.",,"Leaf, portion of root. Astore, Dr. Falconer (J. D. N.) [Dr. H. Trimen, who examined this specimen when describing the assafoetida plants in ""Medicinal Plants,"" labelled it in pencil: ""Narthex Assafoetida, Falc. : Ferula Narthex, Boiss."" Some of the leaflets are crenate serrate towards the tip, and Dr. O. Stapf, who described F. Polakii, assures me (E. M. H.) that this plant is identical with F. Narthex, Boiss., and that the leaf in living plants shows all gradations from entire to strongly serrate margins. It would appear, therefore, that F. Narthex, Boiss., F. Polakii, Stapf, and F. futilissima, Regel and Schmal, are forms of one species. —See note under c and d.]",,
DICOTYLEDONES,MYRTACE.E.,"Ferula Narthex, Boiss.",,"Branch with ripe fruiting umbels, but without leaves. Ferula Assafoetida, L., Kashmir, Dr. Falconer ex. Herb. Heber. On this sheet are attached 4 specimens of detached fruits, and 1 of flowers.",,
